{"_meta": {"api_version": "1", "contract_version": "1.18", "generated_at": "2026-07-22T01:57:35+00:00", "provenance": "socrata", "data_tier": "derived", "tier_note": "line and member-segment stats are derived from real CDOT bike-route segments (street lines) or crowdsourced OSM trail geometry (trail lines).", "license": "City of Chicago Data Portal Terms of Use (data.cityofchicago.org); derived analyses by On Your Left!", "attribution": "On Your Left! \u2014 Chicago bike safety, on the record (https://github.com/jartinator/chicago-safe-streets-data)", "human_page": "https://jartinator.github.io/chicago-safe-streets-data/network.html", "methodology": "https://jartinator.github.io/chicago-safe-streets-data/methodology.html", "schema": "https://jartinator.github.io/chicago-safe-streets-data/api/v1/schemas/route-line.schema.json"}, "id": "state-indiana", "name": "State\u2013Indiana Line", "termini": "South Loop \u21c4 Roseland", "source": "bike_routes", "miles_total": 10.5, "miles_by_grade": {"paint": 3.71, "none": 3.02, "protected": 3.78}, "pct_protected": 36.0, "crashes_total": 61, "member_segments": [{"label": "STATE", "grade": "paint", "length_m": 5930.8, "crashes": 22}, {"label": "INDIANA", "grade": "protected", "length_m": 4846.4, "crashes": 14}, {"label": "STATE", "grade": "none", "length_m": 2623.2, "crashes": 13}, {"label": "INDIANA", "grade": "none", "length_m": 2231.8, "crashes": 1}, {"label": "STATE", "grade": "protected", "length_m": 1229.3, "crashes": 9}, {"label": "INDIANA", "grade": "paint", "length_m": 35.9, "crashes": 2}], "interchanges": [{"id": "node-002", "label": "State\u2013Indiana Line \u00d7 83rd Street Line", "lines": ["state-indiana", "83rd"]}, {"id": "node-005", "label": "State\u2013Indiana Line \u00d7 Marquette Line", "lines": ["state-indiana", "marquette"]}], "note": "member_segments aggregate this line's published CDOT bike-route segments (or OSM trail ways) by street and grade; crashes counts police-reported cyclist crashes within 30 m of the segment (null for off-street trail geometry, which carries no crash join).", "see_also": {"routes_index": "https://jartinator.github.io/chicago-safe-streets-data/api/v1/routes/index.json"}}