{"_meta": {"api_version": "1", "contract_version": "1.14", "generated_at": "2026-07-22T01:57:35+00:00", "provenance": "socrata", "data_tier": "derived", "tier_note": "line and member-segment stats are derived from real CDOT bike-route segments (street lines) or crowdsourced OSM trail geometry (trail lines).", "license": "City of Chicago Data Portal Terms of Use (data.cityofchicago.org); derived analyses by On Your Left!", "attribution": "On Your Left! \u2014 Chicago bike safety, on the record (https://github.com/jartinator/chicago-safe-streets-data)", "human_page": "https://jartinator.github.io/chicago-safe-streets-data/network.html", "methodology": "https://jartinator.github.io/chicago-safe-streets-data/methodology.html", "schema": "https://jartinator.github.io/chicago-safe-streets-data/api/v1/schemas/route-line.schema.json"}, "id": "north-branch", "name": "North Branch Trail", "termini": "Gompers Park \u21c4 Botanic Garden", "source": "osm_trails", "miles_total": 13.21, "miles_by_grade": {"offstreet": 13.21}, "pct_protected": null, "crashes_total": null, "member_segments": [{"label": "curated-trail-north-branch-trail", "grade": "offstreet", "length_m": 21262.3, "crashes": null}], "interchanges": [], "note": "member_segments aggregate this line's published CDOT bike-route segments (or OSM trail ways) by street and grade; crashes counts police-reported cyclist crashes within 30 m of the segment (null for off-street trail geometry, which carries no crash join).", "see_also": {"routes_index": "https://jartinator.github.io/chicago-safe-streets-data/api/v1/routes/index.json"}}