{"_meta": {"api_version": "1", "contract_version": "1.14", "generated_at": "2026-07-13T05:11:21+00:00", "provenance": "socrata", "data_tier": "derived", "tier_note": "line and member-segment stats are derived from real CDOT bike-route segments (street lines) or crowdsourced OSM trail geometry (trail lines).", "license": "City of Chicago Data Portal Terms of Use (data.cityofchicago.org); derived analyses by On Your Left!", "attribution": "On Your Left! \u2014 Chicago bike safety, on the record (https://github.com/jartinator/chicago-safe-streets-data)", "human_page": "https://jartinator.github.io/chicago-safe-streets-data/network.html", "methodology": "https://jartinator.github.io/chicago-safe-streets-data/methodology.html", "schema": "https://jartinator.github.io/chicago-safe-streets-data/api/v1/schemas/route-line.schema.json"}, "id": "83rd", "name": "83rd Street Line", "termini": "Scottsdale \u21c4 South Chicago", "source": "bike_routes", "miles_total": 6.25, "miles_by_grade": {"paint": 3.99, "none": 2.18, "protected": 0.08}, "pct_protected": 1.3, "crashes_total": 24, "member_segments": [{"label": "83RD", "grade": "paint", "length_m": 6419.1, "crashes": 14}, {"label": "83RD", "grade": "none", "length_m": 3505.5, "crashes": 9}, {"label": "83RD", "grade": "protected", "length_m": 127.3, "crashes": 1}], "interchanges": [{"id": "node-001", "label": "State\u2013Indiana Line \u00d7 83rd Street Line", "lines": ["state-indiana", "83rd"]}], "note": "member_segments aggregate this line's published CDOT bike-route segments (or OSM trail ways) by street and grade; crashes counts police-reported cyclist crashes within 30 m of the segment (null for off-street trail geometry, which carries no crash join).", "see_also": {"routes_index": "https://jartinator.github.io/chicago-safe-streets-data/api/v1/routes/index.json"}}