{"_meta": {"api_version": "1", "contract_version": "1.14", "generated_at": "2026-07-14T04:14:48+00:00", "provenance": "fixtures", "data_tier": "derived", "tier_note": "line and member-segment stats are derived from real CDOT bike-route segments (street lines) or crowdsourced OSM trail geometry (trail lines).", "license": "City of Chicago Data Portal Terms of Use (data.cityofchicago.org); derived analyses by On Your Left!", "attribution": "On Your Left! \u2014 Chicago bike safety, on the record (https://github.com/jartinator/chicago-safe-streets-data)", "human_page": "https://jartinator.github.io/chicago-safe-streets-data/network.html", "methodology": "https://jartinator.github.io/chicago-safe-streets-data/methodology.html", "schema": "https://jartinator.github.io/chicago-safe-streets-data/api/v1/schemas/route-line.schema.json"}, "id": "lawrence", "name": "Lawrence Line", "termini": "Jefferson Park \u21c4 Uptown", "source": "bike_routes", "miles_total": 0, "miles_by_grade": {}, "pct_protected": null, "crashes_total": 0, "member_segments": [], "interchanges": [], "note": "member_segments aggregate this line's published CDOT bike-route segments (or OSM trail ways) by street and grade; crashes counts police-reported cyclist crashes within 30 m of the segment (null for off-street trail geometry, which carries no crash join).", "see_also": {"routes_index": "https://jartinator.github.io/chicago-safe-streets-data/api/v1/routes/index.json"}}