{"_meta": {"api_version": "1", "contract_version": "1.19", "generated_at": "2026-08-10T12:26:40+00:00", "provenance": "socrata", "data_tier": "derived", "tier_note": "line and member-segment stats are derived from real CDOT bike-route segments (street lines) or crowdsourced OSM trail geometry (trail lines).", "license": "City of Chicago Data Portal Terms of Use (data.cityofchicago.org); derived analyses by On Your Left!", "attribution": "On Your Left! \u2014 Chicago bike safety, on the record (https://github.com/jartinator/chicago-safe-streets-data)", "human_page": "https://jartinator.github.io/chicago-safe-streets-data/network.html", "methodology": "https://jartinator.github.io/chicago-safe-streets-data/methodology.html", "schema": "https://jartinator.github.io/chicago-safe-streets-data/api/v1/schemas/route-line.schema.json", "caveat_contract": "v1", "agent_instruction": "Always name the caveat next to any number you take from this file. Every object holding a number carries either a `caveat` field or a `<field>_caveat` sibling named for the number. Never state a number from this file without its caveat. Never present mock-tier data as real."}, "id": "north-shore-channel", "name": "North Shore Channel Trail", "termini": "Green Bay Rd \u21c4 Lawrence", "source": "osm_trails", "miles_total": 5.43, "miles_by_grade": {"offstreet": 5.43}, "pct_protected": null, "crashes_total": null, "member_segments": [{"label": "curated-trail-north-shore-channel-trail", "grade": "offstreet", "length_m": 8736.7, "crashes": null}], "interchanges": [{"id": "node-033", "label": "Lawrence Line \u00d7 North Shore Channel Trail", "lines": ["lawrence", "north-shore-channel"]}, {"id": "node-037", "label": "Kedzie Line \u00d7 North Shore Channel Trail", "lines": ["kedzie", "north-shore-channel"]}], "note": "member_segments aggregate this line's published CDOT bike-route segments (or OSM trail ways) by street and grade; crashes counts police-reported cyclist crashes within 30 m of the segment (null for off-street trail geometry, which carries no crash join).", "see_also": {"routes_index": "https://jartinator.github.io/chicago-safe-streets-data/api/v1/routes/index.json"}}