{"_meta": {"api_version": "1", "contract_version": "1.18", "generated_at": "2026-07-22T01:57:35+00:00", "provenance": "socrata", "data_tier": "derived", "tier_note": "line and member-segment stats are derived from real CDOT bike-route segments (street lines) or crowdsourced OSM trail geometry (trail lines).", "license": "City of Chicago Data Portal Terms of Use (data.cityofchicago.org); derived analyses by On Your Left!", "attribution": "On Your Left! \u2014 Chicago bike safety, on the record (https://github.com/jartinator/chicago-safe-streets-data)", "human_page": "https://jartinator.github.io/chicago-safe-streets-data/network.html", "methodology": "https://jartinator.github.io/chicago-safe-streets-data/methodology.html", "schema": "https://jartinator.github.io/chicago-safe-streets-data/api/v1/schemas/route-line.schema.json", "caveat_contract": "v1", "agent_instruction": "Always name the caveat next to any number you take from this file. Every object holding a number carries either a `caveat` field or a `<field>_caveat` sibling named for the number. Never state a number from this file without its caveat. Never present mock-tier data as real."}, "id": "damen", "name": "Damen Line", "termini": "81st \u21c4 Bryn Mawr", "source": "bike_routes", "miles_total": 13.27, "miles_by_grade": {"paint": 11.6, "none": 0.16, "protected": 1.51}, "pct_protected": 11.4, "crashes_total": 411, "member_segments": [{"label": "DAMEN", "grade": "paint", "length_m": 18661.3, "crashes": 366}, {"label": "DAMEN", "grade": "protected", "length_m": 2423.8, "crashes": 30}, {"label": "DAMEN", "grade": "none", "length_m": 263.7, "crashes": 15}], "interchanges": [{"id": "node-001", "label": "Damen Line \u00d7 Major Taylor Trail", "lines": ["damen", "major-taylor"]}, {"id": "node-003", "label": "Damen Line \u00d7 Marquette Line", "lines": ["damen", "marquette"]}, {"id": "node-015", "label": "Damen Line \u00d7 Lake Street Line", "lines": ["damen", "lake"]}, {"id": "node-019", "label": "Milwaukee\u2013Washington Line \u00d7 Damen Line", "lines": ["milwaukee-washington", "damen"]}, {"id": "node-020", "label": "Damen Line \u00d7 Bloomingdale Trail (606)", "lines": ["damen", "bloomingdale"]}, {"id": "node-025", "label": "Damen Line \u00d7 Elston Line", "lines": ["damen", "elston"]}, {"id": "node-034", "label": "Damen Line \u00d7 Lawrence Line", "lines": ["damen", "lawrence"]}], "note": "member_segments aggregate this line's published CDOT bike-route segments (or OSM trail ways) by street and grade; crashes counts police-reported cyclist crashes within 30 m of the segment (null for off-street trail geometry, which carries no crash join).", "see_also": {"routes_index": "https://jartinator.github.io/chicago-safe-streets-data/api/v1/routes/index.json"}}