{"_meta": {"api_version": "1", "contract_version": "1.17", "generated_at": "2026-07-22T01:57:35+00:00", "provenance": "socrata", "data_tier": "derived", "tier_note": "line and member-segment stats are derived from real CDOT bike-route segments (street lines) or crowdsourced OSM trail geometry (trail lines).", "license": "City of Chicago Data Portal Terms of Use (data.cityofchicago.org); derived analyses by On Your Left!", "attribution": "On Your Left! \u2014 Chicago bike safety, on the record (https://github.com/jartinator/chicago-safe-streets-data)", "human_page": "https://jartinator.github.io/chicago-safe-streets-data/network.html", "methodology": "https://jartinator.github.io/chicago-safe-streets-data/methodology.html", "schema": "https://jartinator.github.io/chicago-safe-streets-data/api/v1/schemas/route-line.schema.json"}, "id": "milwaukee-washington", "name": "Milwaukee\u2013Washington Line", "termini": "Jefferson Park \u21c4 Austin", "source": "bike_routes", "miles_total": 23.52, "miles_by_grade": {"protected": 9.43, "paint": 11.94, "none": 2.15}, "pct_protected": 40.1, "crashes_total": 1017, "member_segments": [{"label": "MILWAUKEE", "grade": "protected", "length_m": 8186.1, "crashes": 461}, {"label": "WASHINGTON", "grade": "paint", "length_m": 7980.3, "crashes": 73}, {"label": "MILWAUKEE", "grade": "paint", "length_m": 6341.0, "crashes": 249}, {"label": "JACKSON", "grade": "paint", "length_m": 3772.7, "crashes": 32}, {"label": "JACKSON", "grade": "protected", "length_m": 3561.1, "crashes": 26}, {"label": "MILWAUKEE", "grade": "none", "length_m": 2649.1, "crashes": 29}, {"label": "RANDOLPH", "grade": "protected", "length_m": 2234.2, "crashes": 77}, {"label": "RANDOLPH", "grade": "paint", "length_m": 1126.2, "crashes": 18}, {"label": "WASHINGTON", "grade": "protected", "length_m": 1049.3, "crashes": 50}, {"label": "JACKSON", "grade": "none", "length_m": 813.0, "crashes": 0}, {"label": "MICHIGAN", "grade": "protected", "length_m": 137.8, "crashes": 2}], "interchanges": [{"id": "node-007", "label": "Milwaukee\u2013Washington Line \u00d7 Kedzie Line", "lines": ["milwaukee-washington", "kedzie"]}, {"id": "node-008", "label": "Milwaukee\u2013Washington Line \u00d7 California Line", "lines": ["milwaukee-washington", "california"]}, {"id": "node-009", "label": "Milwaukee\u2013Washington Line \u00d7 Halsted Line", "lines": ["milwaukee-washington", "halsted"]}, {"id": "node-010", "label": "Milwaukee\u2013Washington Line \u00d7 Kedzie Line", "lines": ["milwaukee-washington", "kedzie"]}, {"id": "node-011", "label": "Milwaukee\u2013Washington Line \u00d7 Lake Street Line \u00d7 California Line", "lines": ["milwaukee-washington", "lake", "california"]}, {"id": "node-012", "label": "Milwaukee\u2013Washington Line \u00d7 Clark Line", "lines": ["milwaukee-washington", "clark"]}, {"id": "node-014", "label": "Milwaukee\u2013Washington Line \u00d7 Lakefront Trail", "lines": ["milwaukee-washington", "lakefront"]}, {"id": "node-017", "label": "Milwaukee\u2013Washington Line \u00d7 Halsted Line", "lines": ["milwaukee-washington", "halsted"]}, {"id": "node-018", "label": "Milwaukee\u2013Washington Line \u00d7 Elston Line", "lines": ["milwaukee-washington", "elston"]}, {"id": "node-019", "label": "Milwaukee\u2013Washington Line \u00d7 Damen Line", "lines": ["milwaukee-washington", "damen"]}, {"id": "node-021", "label": "Milwaukee\u2013Washington Line \u00d7 Bloomingdale Trail (606)", "lines": ["milwaukee-washington", "bloomingdale"]}, {"id": "node-024", "label": "Milwaukee\u2013Washington Line \u00d7 California Line", "lines": ["milwaukee-washington", "california"]}, {"id": "node-026", "label": "Milwaukee\u2013Washington Line \u00d7 Kedzie Line", "lines": ["milwaukee-washington", "kedzie"]}, {"id": "node-030", "label": "Milwaukee\u2013Washington Line \u00d7 Lawrence Line", "lines": ["milwaukee-washington", "lawrence"]}, {"id": "node-036", "label": "Milwaukee\u2013Washington Line \u00d7 Elston Line", "lines": ["milwaukee-washington", "elston"]}], "note": "member_segments aggregate this line's published CDOT bike-route segments (or OSM trail ways) by street and grade; crashes counts police-reported cyclist crashes within 30 m of the segment (null for off-street trail geometry, which carries no crash join).", "see_also": {"routes_index": "https://jartinator.github.io/chicago-safe-streets-data/api/v1/routes/index.json"}}