{"_meta": {"api_version": "1", "contract_version": "1.18", "generated_at": "2026-07-22T01:57:35+00:00", "provenance": "socrata", "data_tier": "derived", "tier_note": "line and member-segment stats are derived from real CDOT bike-route segments (street lines) or crowdsourced OSM trail geometry (trail lines).", "license": "City of Chicago Data Portal Terms of Use (data.cityofchicago.org); derived analyses by On Your Left!", "attribution": "On Your Left! \u2014 Chicago bike safety, on the record (https://github.com/jartinator/chicago-safe-streets-data)", "human_page": "https://jartinator.github.io/chicago-safe-streets-data/network.html", "methodology": "https://jartinator.github.io/chicago-safe-streets-data/methodology.html", "schema": "https://jartinator.github.io/chicago-safe-streets-data/api/v1/schemas/route-line.schema.json"}, "id": "lake", "name": "Lake Street Line", "termini": "Austin \u21c4 Lakefront", "source": "bike_routes", "miles_total": 9.07, "miles_by_grade": {"paint": 2.68, "none": 0.67, "protected": 5.73}, "pct_protected": 63.2, "crashes_total": 203, "member_segments": [{"label": "LAKE", "grade": "protected", "length_m": 7196.8, "crashes": 59}, {"label": "LAKE", "grade": "paint", "length_m": 2323.3, "crashes": 38}, {"label": "LAKE", "grade": "none", "length_m": 1071.2, "crashes": 9}], "interchanges": [{"id": "node-011", "label": "Milwaukee\u2013Washington Line \u00d7 Lake Street Line \u00d7 California Line", "lines": ["milwaukee-washington", "lake", "california"]}, {"id": "node-013", "label": "Kedzie Line \u00d7 Lake Street Line", "lines": ["kedzie", "lake"]}, {"id": "node-015", "label": "Damen Line \u00d7 Lake Street Line", "lines": ["damen", "lake"]}, {"id": "node-016", "label": "Halsted Line \u00d7 Lake Street Line", "lines": ["halsted", "lake"]}], "note": "member_segments aggregate this line's published CDOT bike-route segments (or OSM trail ways) by street and grade; crashes counts police-reported cyclist crashes within 30 m of the segment (null for off-street trail geometry, which carries no crash join).", "see_also": {"routes_index": "https://jartinator.github.io/chicago-safe-streets-data/api/v1/routes/index.json"}}