{"_meta": {"api_version": "1", "contract_version": "1.16", "generated_at": "2026-07-22T01:57:35+00:00", "provenance": "socrata", "data_tier": "derived", "tier_note": "line and member-segment stats are derived from real CDOT bike-route segments (street lines) or crowdsourced OSM trail geometry (trail lines).", "license": "City of Chicago Data Portal Terms of Use (data.cityofchicago.org); derived analyses by On Your Left!", "attribution": "On Your Left! \u2014 Chicago bike safety, on the record (https://github.com/jartinator/chicago-safe-streets-data)", "human_page": "https://jartinator.github.io/chicago-safe-streets-data/network.html", "methodology": "https://jartinator.github.io/chicago-safe-streets-data/methodology.html", "schema": "https://jartinator.github.io/chicago-safe-streets-data/api/v1/schemas/route-line.schema.json"}, "id": "elston", "name": "Elston Line", "termini": "Goose Island \u21c4 Forest Glen", "source": "bike_routes", "miles_total": 9.59, "miles_by_grade": {"paint": 8.54, "protected": 1.05}, "pct_protected": 10.9, "crashes_total": 237, "member_segments": [{"label": "ELSTON", "grade": "paint", "length_m": 13748.0, "crashes": 208}, {"label": "ELSTON", "grade": "protected", "length_m": 1684.5, "crashes": 29}], "interchanges": [{"id": "node-018", "label": "Milwaukee\u2013Washington Line \u00d7 Elston Line", "lines": ["milwaukee-washington", "elston"]}, {"id": "node-025", "label": "Damen Line \u00d7 Elston Line", "lines": ["damen", "elston"]}, {"id": "node-028", "label": "Elston Line \u00d7 California Line", "lines": ["elston", "california"]}, {"id": "node-029", "label": "Kedzie Line \u00d7 Elston Line", "lines": ["kedzie", "elston"]}, {"id": "node-031", "label": "Elston Line \u00d7 Lawrence Line", "lines": ["elston", "lawrence"]}, {"id": "node-036", "label": "Milwaukee\u2013Washington Line \u00d7 Elston Line", "lines": ["milwaukee-washington", "elston"]}], "note": "member_segments aggregate this line's published CDOT bike-route segments (or OSM trail ways) by street and grade; crashes counts police-reported cyclist crashes within 30 m of the segment (null for off-street trail geometry, which carries no crash join).", "see_also": {"routes_index": "https://jartinator.github.io/chicago-safe-streets-data/api/v1/routes/index.json"}}