{"_meta": {"api_version": "1", "contract_version": "1.14", "generated_at": "2026-07-13T05:11:21+00:00", "provenance": "socrata", "data_tier": "derived", "tier_note": "line and member-segment stats are derived from real CDOT bike-route segments (street lines) or crowdsourced OSM trail geometry (trail lines).", "license": "City of Chicago Data Portal Terms of Use (data.cityofchicago.org); derived analyses by On Your Left!", "attribution": "On Your Left! \u2014 Chicago bike safety, on the record (https://github.com/jartinator/chicago-safe-streets-data)", "human_page": "https://jartinator.github.io/chicago-safe-streets-data/network.html", "methodology": "https://jartinator.github.io/chicago-safe-streets-data/methodology.html"}, "id": "kedzie", "name": "Kedzie Line", "termini": "Brighton Park \u21c4 Touhy", "source": "bike_routes", "miles_total": 11.09, "miles_by_grade": {"paint": 8.22, "protected": 2.87}, "pct_protected": 25.9, "crashes_total": 238, "member_segments": [{"label": "KEDZIE", "grade": "paint", "length_m": 13224.9, "crashes": 203}, {"label": "KEDZIE", "grade": "protected", "length_m": 4619.8, "crashes": 35}], "interchanges": [{"id": "node-006", "label": "Kedzie Line \u00d7 Jackson\u2013Washington Line", "lines": ["kedzie", "jackson-washington"]}, {"id": "node-009", "label": "Kedzie Line \u00d7 Jackson\u2013Washington Line", "lines": ["kedzie", "jackson-washington"]}, {"id": "node-013", "label": "Kedzie Line \u00d7 Lake Street Line", "lines": ["kedzie", "lake"]}, {"id": "node-020", "label": "Kedzie Line \u00d7 Bloomingdale Trail (606)", "lines": ["kedzie", "bloomingdale"]}, {"id": "node-026", "label": "Milwaukee Line \u00d7 Kedzie Line", "lines": ["milwaukee", "kedzie"]}, {"id": "node-029", "label": "Kedzie Line \u00d7 Elston Line", "lines": ["kedzie", "elston"]}, {"id": "node-032", "label": "Kedzie Line \u00d7 Lawrence Line", "lines": ["kedzie", "lawrence"]}], "note": "member_segments aggregate this line's published CDOT bike-route segments (or OSM trail ways) by street and grade; crashes counts police-reported cyclist crashes within 30 m of the segment (null for off-street trail geometry, which carries no crash join).", "see_also": {"routes_index": "https://jartinator.github.io/chicago-safe-streets-data/api/v1/routes/index.json"}}