{"_meta": {"api_version": "1", "contract_version": "1.14", "generated_at": "2026-07-13T05:11:21+00:00", "provenance": "socrata", "data_tier": "derived", "tier_note": "line and member-segment stats are derived from real CDOT bike-route segments (street lines) or crowdsourced OSM trail geometry (trail lines).", "license": "City of Chicago Data Portal Terms of Use (data.cityofchicago.org); derived analyses by On Your Left!", "attribution": "On Your Left! \u2014 Chicago bike safety, on the record (https://github.com/jartinator/chicago-safe-streets-data)", "human_page": "https://jartinator.github.io/chicago-safe-streets-data/network.html", "methodology": "https://jartinator.github.io/chicago-safe-streets-data/methodology.html", "schema": "https://jartinator.github.io/chicago-safe-streets-data/api/v1/schemas/route-line.schema.json"}, "id": "jackson-washington", "name": "Jackson\u2013Washington Line", "termini": "Austin \u21c4 Lakefront", "source": "bike_routes", "miles_total": 11.98, "miles_by_grade": {"protected": 3.47, "paint": 8.0, "none": 0.51}, "pct_protected": 29.0, "crashes_total": 204, "member_segments": [{"label": "WASHINGTON", "grade": "paint", "length_m": 7120.8, "crashes": 50}, {"label": "JACKSON", "grade": "paint", "length_m": 3772.7, "crashes": 32}, {"label": "JACKSON", "grade": "protected", "length_m": 3561.1, "crashes": 26}, {"label": "JACKSON", "grade": "none", "length_m": 813.0, "crashes": 0}], "interchanges": [{"id": "node-006", "label": "Kedzie Line \u00d7 Jackson\u2013Washington Line", "lines": ["kedzie", "jackson-washington"]}, {"id": "node-007", "label": "Jackson\u2013Washington Line \u00d7 California Line", "lines": ["jackson-washington", "california"]}, {"id": "node-008", "label": "Halsted Line \u00d7 Jackson\u2013Washington Line", "lines": ["halsted", "jackson-washington"]}, {"id": "node-009", "label": "Kedzie Line \u00d7 Jackson\u2013Washington Line", "lines": ["kedzie", "jackson-washington"]}, {"id": "node-010", "label": "Lake Street Line \u00d7 Jackson\u2013Washington Line", "lines": ["lake", "jackson-washington"]}, {"id": "node-011", "label": "Lake Street Line \u00d7 Jackson\u2013Washington Line \u00d7 California Line", "lines": ["lake", "jackson-washington", "california"]}], "note": "member_segments aggregate this line's published CDOT bike-route segments (or OSM trail ways) by street and grade; crashes counts police-reported cyclist crashes within 30 m of the segment (null for off-street trail geometry, which carries no crash join).", "see_also": {"routes_index": "https://jartinator.github.io/chicago-safe-streets-data/api/v1/routes/index.json"}}