{"_meta": {"api_version": "1", "contract_version": "1.15", "generated_at": "2026-07-21T01:52:35+00:00", "provenance": "socrata", "data_tier": "derived", "tier_note": "line and member-segment stats are derived from real CDOT bike-route segments (street lines) or crowdsourced OSM trail geometry (trail lines).", "license": "City of Chicago Data Portal Terms of Use (data.cityofchicago.org); derived analyses by On Your Left!", "attribution": "On Your Left! \u2014 Chicago bike safety, on the record (https://github.com/jartinator/chicago-safe-streets-data)", "human_page": "https://jartinator.github.io/chicago-safe-streets-data/network.html", "methodology": "https://jartinator.github.io/chicago-safe-streets-data/methodology.html", "schema": "https://jartinator.github.io/chicago-safe-streets-data/api/v1/schemas/route-line.schema.json"}, "id": "clark", "name": "Clark Line", "termini": "Lakefront \u21c4 Devon", "source": "bike_routes", "miles_total": 9.74, "miles_by_grade": {"paint": 4.18, "protected": 4.98, "none": 0.58}, "pct_protected": 51.2, "crashes_total": 683, "member_segments": [{"label": "CLARK", "grade": "paint", "length_m": 5596.1, "crashes": 314}, {"label": "CLARK", "grade": "protected", "length_m": 4492.3, "crashes": 150}, {"label": "DEARBORN", "grade": "protected", "length_m": 1905.7, "crashes": 99}, {"label": "CLARK", "grade": "none", "length_m": 927.7, "crashes": 41}], "interchanges": [{"id": "node-011", "label": "Milwaukee\u2013Washington Line \u00d7 Clark Line", "lines": ["milwaukee-washington", "clark"]}, {"id": "node-025", "label": "Halsted Line \u00d7 Clark Line", "lines": ["halsted", "clark"]}, {"id": "node-032", "label": "Clark Line \u00d7 Lawrence Line", "lines": ["clark", "lawrence"]}], "note": "member_segments aggregate this line's published CDOT bike-route segments (or OSM trail ways) by street and grade; crashes counts police-reported cyclist crashes within 30 m of the segment (null for off-street trail geometry, which carries no crash join).", "see_also": {"routes_index": "https://jartinator.github.io/chicago-safe-streets-data/api/v1/routes/index.json"}}