{"_meta": {"api_version": "1", "contract_version": "1.14", "generated_at": "2026-07-14T04:14:48+00:00", "provenance": "fixtures", "data_tier": "derived", "tier_note": "line and member-segment stats are derived from real CDOT bike-route segments (street lines) or crowdsourced OSM trail geometry (trail lines).", "license": "City of Chicago Data Portal Terms of Use (data.cityofchicago.org); derived analyses by On Your Left!", "attribution": "On Your Left! \u2014 Chicago bike safety, on the record (https://github.com/jartinator/chicago-safe-streets-data)", "human_page": "https://jartinator.github.io/chicago-safe-streets-data/network.html", "methodology": "https://jartinator.github.io/chicago-safe-streets-data/methodology.html", "schema": "https://jartinator.github.io/chicago-safe-streets-data/api/v1/schemas/route-line.schema.json"}, "id": "milwaukee", "name": "Milwaukee Line", "termini": "Lakefront \u21c4 Jefferson Park", "source": "bike_routes", "miles_total": 8.21, "miles_by_grade": {"paint": 8.21}, "pct_protected": 0.0, "crashes_total": 72, "member_segments": [{"label": "MILWAUKEE", "grade": "paint", "length_m": 13213.0, "crashes": 72}], "interchanges": [{"id": "node-001", "label": "Milwaukee Line \u00d7 Halsted Line", "lines": ["milwaukee", "halsted"]}, {"id": "node-002", "label": "Milwaukee Line \u00d7 Damen Line", "lines": ["milwaukee", "damen"]}], "note": "member_segments aggregate this line's published CDOT bike-route segments (or OSM trail ways) by street and grade; crashes counts police-reported cyclist crashes within 30 m of the segment (null for off-street trail geometry, which carries no crash join).", "see_also": {"routes_index": "https://jartinator.github.io/chicago-safe-streets-data/api/v1/routes/index.json"}}