{"_meta": {"api_version": "1", "contract_version": "1.14", "generated_at": "2026-07-13T05:11:21+00:00", "provenance": "socrata", "data_tier": "derived", "tier_note": "line and member-segment stats are derived from real CDOT bike-route segments (street lines) or crowdsourced OSM trail geometry (trail lines).", "license": "City of Chicago Data Portal Terms of Use (data.cityofchicago.org); derived analyses by On Your Left!", "attribution": "On Your Left! \u2014 Chicago bike safety, on the record (https://github.com/jartinator/chicago-safe-streets-data)", "human_page": "https://jartinator.github.io/chicago-safe-streets-data/network.html", "methodology": "https://jartinator.github.io/chicago-safe-streets-data/methodology.html", "schema": "https://jartinator.github.io/chicago-safe-streets-data/api/v1/schemas/route-line.schema.json"}, "id": "halsted", "name": "Halsted Line", "termini": "79th \u21c4 Waveland", "source": "bike_routes", "miles_total": 13.46, "miles_by_grade": {"paint": 8.94, "protected": 4.12, "none": 0.41}, "pct_protected": 30.6, "crashes_total": 613, "member_segments": [{"label": "HALSTED", "grade": "paint", "length_m": 14383.9, "crashes": 498}, {"label": "HALSTED", "grade": "protected", "length_m": 6626.0, "crashes": 69}, {"label": "HALSTED", "grade": "none", "length_m": 651.9, "crashes": 46}], "interchanges": [{"id": "node-003", "label": "Halsted Line \u00d7 Marquette Line", "lines": ["halsted", "marquette"]}, {"id": "node-008", "label": "Halsted Line \u00d7 Jackson\u2013Washington Line", "lines": ["halsted", "jackson-washington"]}, {"id": "node-016", "label": "Halsted Line \u00d7 Lake Street Line", "lines": ["halsted", "lake"]}, {"id": "node-017", "label": "Milwaukee Line \u00d7 Halsted Line", "lines": ["milwaukee", "halsted"]}, {"id": "node-027", "label": "Halsted Line \u00d7 Clark Line", "lines": ["halsted", "clark"]}], "note": "member_segments aggregate this line's published CDOT bike-route segments (or OSM trail ways) by street and grade; crashes counts police-reported cyclist crashes within 30 m of the segment (null for off-street trail geometry, which carries no crash join).", "see_also": {"routes_index": "https://jartinator.github.io/chicago-safe-streets-data/api/v1/routes/index.json"}}