{"_meta": {"api_version": "1", "contract_version": "1.15", "generated_at": "2026-07-22T01:57:35+00:00", "provenance": "socrata", "data_tier": "derived", "tier_note": "line and member-segment stats are derived from real CDOT bike-route segments (street lines) or crowdsourced OSM trail geometry (trail lines).", "license": "City of Chicago Data Portal Terms of Use (data.cityofchicago.org); derived analyses by On Your Left!", "attribution": "On Your Left! \u2014 Chicago bike safety, on the record (https://github.com/jartinator/chicago-safe-streets-data)", "human_page": "https://jartinator.github.io/chicago-safe-streets-data/network.html", "methodology": "https://jartinator.github.io/chicago-safe-streets-data/methodology.html", "schema": "https://jartinator.github.io/chicago-safe-streets-data/api/v1/schemas/route-line.schema.json"}, "id": "california", "name": "California Line", "termini": "Little Village \u21c4 West Ridge", "source": "bike_routes", "miles_total": 9.08, "miles_by_grade": {"paint": 5.9, "none": 2.89, "protected": 0.29}, "pct_protected": 3.2, "crashes_total": 180, "member_segments": [{"label": "CALIFORNIA", "grade": "paint", "length_m": 9494.3, "crashes": 136}, {"label": "CALIFORNIA", "grade": "none", "length_m": 4650.3, "crashes": 32}, {"label": "CALIFORNIA", "grade": "protected", "length_m": 464.3, "crashes": 12}], "interchanges": [{"id": "node-008", "label": "Milwaukee\u2013Washington Line \u00d7 California Line", "lines": ["milwaukee-washington", "california"]}, {"id": "node-011", "label": "Milwaukee\u2013Washington Line \u00d7 Lake Street Line \u00d7 California Line", "lines": ["milwaukee-washington", "lake", "california"]}, {"id": "node-022", "label": "California Line \u00d7 Bloomingdale Trail (606)", "lines": ["california", "bloomingdale"]}, {"id": "node-024", "label": "Milwaukee\u2013Washington Line \u00d7 California Line", "lines": ["milwaukee-washington", "california"]}, {"id": "node-028", "label": "Elston Line \u00d7 California Line", "lines": ["elston", "california"]}], "note": "member_segments aggregate this line's published CDOT bike-route segments (or OSM trail ways) by street and grade; crashes counts police-reported cyclist crashes within 30 m of the segment (null for off-street trail geometry, which carries no crash join).", "see_also": {"routes_index": "https://jartinator.github.io/chicago-safe-streets-data/api/v1/routes/index.json"}}